the women prep1 the son say that the farmer prep2 the friend stops the mother,DP,feminine,plural,that-clause,,,,,FAILED,declarative,,,,,,,,,
the mothers prep1 the brother declare that the student prep2 the sister attracts the girls,DP,feminine,plural,that-clause,,,,,FAILED,declarative,,,,,,,,,
the daughters prep1 the father say that the brother prep2 the sisters stops the friend,DP,feminine,plural,that-clause,,,,,FAILED,declarative,,,,,,,,,
the daughters prep1 the man remember that the boy prep2 the farmers defends the friends,DP,feminine,plural,that-clause,,,,,FAILED,declarative,,,,,,,,,
the women prep1 the boys declare that the son prep2 the friend attracts the farmer,DP,feminine,plural,that-clause,,,,,FAILED,declarative,,,,,,,,,
the mothers prep1 the sons remember that the farmer prep2 the brother ignores the actors,DP,feminine,plural,that-clause,,,,,FAILED,declarative,,,,,,,,,
the daughters prep1 the actors remember that the brother prep2 the farmer defends the girls,DP,feminine,plural,that-clause,,,,,FAILED,declarative,,,,,,,,,
the women prep1 the boys say that the son prep2 the brothers attracts the brother,DP,feminine,plural,that-clause,,,,,FAILED,declarative,,,,,,,,,
the sisters prep1 the brothers declare that the farmer prep2 the boys defends the friends,DP,feminine,plural,that-clause,,,,,FAILED,declarative,,,,,,,,,
the women prep1 the fathers declare that the boy prep2 the sons observes the actresses,DP,feminine,plural,that-clause,,,,,FAILED,declarative,,,,,,,,,
the mothers prep1 the brothers declare that the boy prep2 the farmer observes the sons,DP,feminine,plural,that-clause,,,,,FAILED,declarative,,,,,,,,,
the farmers prep1 the brothers declare that the brother prep2 the woman watches the daughters,DP,feminine,plural,that-clause,,,,,FAILED,declarative,,,,,,,,,
the students prep1 the actors remember that the son prep2 the women defends the brother,DP,feminine,plural,that-clause,,,,,FAILED,declarative,,,,,,,,,
the sisters prep1 the woman say that the actor prep2 the farmer observes the fathers,DP,feminine,plural,that-clause,,,,,FAILED,declarative,,,,,,,,,
the farmers prep1 the sister declare that the actor prep2 the brothers knows the student,DP,feminine,plural,that-clause,,,,,FAILED,declarative,,,,,,,,,
the daughters prep1 the sister say that the actor prep2 the students meets the men,DP,feminine,plural,that-clause,,,,,FAILED,declarative,,,,,,,,,
the actresses prep1 the student say that the brother prep2 the girl welcomes the sisters,DP,feminine,plural,that-clause,,,,,FAILED,declarative,,,,,,,,,
the sisters prep1 the farmer declare that the actor prep2 the women greets the friends,DP,feminine,plural,that-clause,,,,,FAILED,declarative,,,,,,,,,
the friends prep1 the girls remember that the brother prep2 the son blocks the brother,DP,feminine,plural,that-clause,,,,,FAILED,declarative,,,,,,,,,
the actresses prep1 the students remember that the farmer prep2 the father welcomes the sisters,DP,feminine,plural,that-clause,,,,,FAILED,declarative,,,,,,,,,
the mothers prep1 the students remember that the boy prep2 the brothers stops the brother,DP,feminine,plural,that-clause,,,,,FAILED,declarative,,,,,,,,,
the students prep1 the farmers remember that the brother prep2 the friend greets the brother,DP,feminine,plural,that-clause,,,,,FAILED,declarative,,,,,,,,,
the sisters prep1 the girls declare that the friend prep2 the mother stops the farmer,DP,feminine,plural,that-clause,,,,,FAILED,declarative,,,,,,,,,
the students prep1 the mothers remember that the farmer prep2 the girl watches the friends,DP,feminine,plural,that-clause,,,,,FAILED,declarative,,,,,,,,,
the actresses prep1 the farmers declare that the brother prep2 the women attracts the brother,DP,feminine,plural,that-clause,,,,,FAILED,declarative,,,,,,,,,
the farmers prep1 the daughters say that the boy prep2 the mothers greets the student,DP,feminine,plural,that-clause,,,,,FAILED,declarative,,,,,,,,,
the mothers prep1 the boy remember that the actors prep2 the man greet the brother,DP,feminine,plural,that-clause,,,,,FAILED,declarative,,,,,,,,,
the girls prep1 the farmer declare that the students prep2 the father block the sons,DP,feminine,plural,that-clause,,,,,FAILED,declarative,,,,,,,,,
the actresses prep1 the father remember that the men prep2 the student watch the farmer,DP,feminine,plural,that-clause,,,,,FAILED,declarative,,,,,,,,,
the women prep1 the father say that the boys prep2 the son block the students,DP,feminine,plural,that-clause,,,,,FAILED,declarative,,,,,,,,,
the sisters prep1 the brother say that the friends prep2 the sons block the women,DP,feminine,plural,that-clause,,,,,FAILED,declarative,,,,,,,,,
the mothers prep1 the actor remember that the boys prep2 the friend interrupt the farmers,DP,feminine,plural,that-clause,,,,,FAILED,declarative,,,,,,,,,
the actresses prep1 the farmer say that the friends prep2 the women watch the student,DP,feminine,plural,that-clause,,,,,FAILED,declarative,,,,,,,,,
the women prep1 the son declare that the boys prep2 the friends watch the student,DP,feminine,plural,that-clause,,,,,FAILED,declarative,,,,,,,,,
the sisters prep1 the man declare that the students prep2 the actresses know the sisters,DP,feminine,plural,that-clause,,,,,FAILED,declarative,,,,,,,,,
the sisters prep1 the fathers remember that the farmers prep2 the friend know the men,DP,feminine,plural,that-clause,,,,,FAILED,declarative,,,,,,,,,
the friends prep1 the actors remember that the sons prep2 the farmer know the students,DP,feminine,plural,that-clause,,,,,FAILED,declarative,,,,,,,,,
the actresses prep1 the students declare that the brothers prep2 the sister stop the farmer,DP,feminine,plural,that-clause,,,,,FAILED,declarative,,,,,,,,,
the actresses prep1 the students remember that the fathers prep2 the farmer interrupt the sons,DP,feminine,plural,that-clause,,,,,FAILED,declarative,,,,,,,,,
the girls prep1 the farmers remember that the sons prep2 the mother observe the actress,DP,feminine,plural,that-clause,,,,,FAILED,declarative,,,,,,,,,
the students prep1 the men declare that the friends prep2 the girls welcome the mother,DP,feminine,plural,that-clause,,,,,FAILED,declarative,,,,,,,,,
the sisters prep1 the mother say that the brothers prep2 the brother greet the sons,DP,feminine,plural,that-clause,,,,,FAILED,declarative,,,,,,,,,
the daughters prep1 the farmer remember that the brothers prep2 the father watch the sister,DP,feminine,plural,that-clause,,,,,FAILED,declarative,,,,,,,,,
the actresses prep1 the farmer say that the brothers prep2 the boy block the mothers,DP,feminine,plural,that-clause,,,,,FAILED,declarative,,,,,,,,,
the friends prep1 the sister say that the fathers prep2 the actors greet the farmer,DP,feminine,plural,that-clause,,,,,FAILED,declarative,,,,,,,,,
the actresses prep1 the sister remember that the brothers prep2 the daughter stop the fathers,DP,feminine,plural,that-clause,,,,,FAILED,declarative,,,,,,,,,
the women prep1 the actress remember that the boys prep2 the farmer welcome the mother,DP,feminine,plural,that-clause,,,,,FAILED,declarative,,,,,,,,,
the actresses prep1 the girl remember that the friends prep2 the sister ignore the sisters,DP,feminine,plural,that-clause,,,,,FAILED,declarative,,,,,,,,,
the actresses prep1 the woman say that the friends prep2 the daughters stop the brother,DP,feminine,plural,that-clause,,,,,FAILED,declarative,,,,,,,,,
the women prep1 the farmer remember that the students prep2 the girls meet the brothers,DP,feminine,plural,that-clause,,,,,FAILED,declarative,,,,,,,,,
the students prep1 the girl declare that the men prep2 the farmers attract the friends,DP,feminine,plural,that-clause,,,,,FAILED,declarative,,,,,,,,,
the mothers prep1 the students declare that the farmers prep2 the actor observe the man,DP,feminine,plural,that-clause,,,,,FAILED,declarative,,,,,,,,,
the daughters prep1 the farmers declare that the men prep2 the father interrupt the sister,DP,feminine,plural,that-clause,,,,,FAILED,declarative,,,,,,,,,
the mothers prep1 the daughters remember that the actors prep2 the students avoid the farmers,DP,feminine,plural,that-clause,,,,,FAILED,declarative,,,,,,,,,
the women prep1 the friends remember that the sons prep2 the sister watch the boy,DP,feminine,plural,that-clause,,,,,FAILED,declarative,,,,,,,,,
the students prep1 the women declare that the boys prep2 the friend defend the farmers,DP,feminine,plural,that-clause,,,,,FAILED,declarative,,,,,,,,,
the farmers prep1 the women say that the students prep2 the mother avoid the friend,DP,feminine,plural,that-clause,,,,,FAILED,declarative,,,,,,,,,
the daughters prep1 the actresses say that the men prep2 the sister defend the friends,DP,feminine,plural,that-clause,,,,,FAILED,declarative,,,,,,,,,
the farmers prep1 the mothers remember that the friends prep2 the sisters know the son,DP,feminine,plural,that-clause,,,,,FAILED,declarative,,,,,,,,,
the girls prep1 the mothers remember that the farmers prep2 the students defend the men,DP,feminine,plural,that-clause,,,,,FAILED,declarative,,,,,,,,,
the sisters prep1 the mothers declare that the sons prep2 the sisters block the friend,DP,feminine,plural,that-clause,,,,,FAILED,declarative,,,,,,,,,
the women prep1 the brother remember that the sister prep2 the farmer attracts the brother,DP,feminine,plural,that-clause,,,,,FAILED,declarative,,,,,,,,,
the mothers prep1 the son say that the farmer prep2 the actor stops the girls,DP,feminine,plural,that-clause,,,,,FAILED,declarative,,,,,,,,,
the daughters prep1 the man say that the actress prep2 the boys ignores the brother,DP,feminine,plural,that-clause,,,,,FAILED,declarative,,,,,,,,,
the mothers prep1 the student declare that the daughter prep2 the farmers greets the men,DP,feminine,plural,that-clause,,,,,FAILED,declarative,,,,,,,,,
the girls prep1 the son remember that the sister prep2 the student defends the actor,DP,feminine,plural,that-clause,,,,,FAILED,declarative,,,,,,,,,
the farmers prep1 the man remember that the sister prep2 the daughter welcomes the brothers,DP,feminine,plural,that-clause,,,,,FAILED,declarative,,,,,,,,,
the sisters prep1 the friend declare that the mother prep2 the student avoids the girl,DP,feminine,plural,that-clause,,,,,FAILED,declarative,,,,,,,,,
the daughters prep1 the boy remember that the woman prep2 the farmers blocks the students,DP,feminine,plural,that-clause,,,,,FAILED,declarative,,,,,,,,,
the daughters prep1 the man say that the farmer prep2 the sisters interrupts the girl,DP,feminine,plural,that-clause,,,,,FAILED,declarative,,,,,,,,,
the women prep1 the fathers declare that the sister prep2 the brother greets the daughter,DP,feminine,plural,that-clause,,,,,FAILED,declarative,,,,,,,,,
the mothers prep1 the farmers remember that the friend prep2 the man welcomes the girls,DP,feminine,plural,that-clause,,,,,FAILED,declarative,,,,,,,,,
the mothers prep1 the brothers remember that the farmer prep2 the sons watches the boy,DP,feminine,plural,that-clause,,,,,FAILED,declarative,,,,,,,,,
the sisters prep1 the brothers declare that the girl prep2 the actors attracts the sons,DP,feminine,plural,that-clause,,,,,FAILED,declarative,,,,,,,,,
the students prep1 the brothers declare that the girl prep2 the friends avoids the woman,DP,feminine,plural,that-clause,,,,,FAILED,declarative,,,,,,,,,
the friends prep1 the fathers declare that the girl prep2 the student knows the man,DP,feminine,plural,that-clause,,,,,FAILED,declarative,,,,,,,,,
the sisters prep1 the brothers declare that the sister prep2 the friend meets the students,DP,feminine,plural,that-clause,,,,,FAILED,declarative,,,,,,,,,
the daughters prep1 the students declare that the mother prep2 the women defends the actor,DP,feminine,plural,that-clause,,,,,FAILED,declarative,,,,,,,,,
the sisters prep1 the students declare that the farmer prep2 the friends blocks the men,DP,feminine,plural,that-clause,,,,,FAILED,declarative,,,,,,,,,
the sisters prep1 the students declare that the mother prep2 the friends welcomes the farmer,DP,feminine,plural,that-clause,,,,,FAILED,declarative,,,,,,,,,
the friends prep1 the students say that the actress prep2 the mothers blocks the women,DP,feminine,plural,that-clause,,,,,FAILED,declarative,,,,,,,,,
the sisters prep1 the girl say that the farmer prep2 the brother knows the sister,DP,feminine,plural,that-clause,,,,,FAILED,declarative,,,,,,,,,
the daughters prep1 the woman remember that the sister prep2 the actor defends the girls,DP,feminine,plural,that-clause,,,,,FAILED,declarative,,,,,,,,,
the mothers prep1 the farmer remember that the woman prep2 the boys blocks the sons,DP,feminine,plural,that-clause,,,,,FAILED,declarative,,,,,,,,,
the friends prep1 the sister say that the farmer prep2 the actors ignores the student,DP,feminine,plural,that-clause,,,,,FAILED,declarative,,,,,,,,,
the farmers prep1 the girl say that the friend prep2 the brothers watches the sisters,DP,feminine,plural,that-clause,,,,,FAILED,declarative,,,,,,,,,
the sisters prep1 the actress say that the farmer prep2 the woman greets the brother,DP,feminine,plural,that-clause,,,,,FAILED,declarative,,,,,,,,,
the farmers prep1 the girl declare that the woman prep2 the sister attracts the actresses,DP,feminine,plural,that-clause,,,,,FAILED,declarative,,,,,,,,,
the daughters prep1 the friend declare that the mother prep2 the students stops the boy,DP,feminine,plural,that-clause,,,,,FAILED,declarative,,,,,,,,,
the actresses prep1 the mother declare that the sister prep2 the women ignores the friends,DP,feminine,plural,that-clause,,,,,FAILED,declarative,,,,,,,,,
the daughters prep1 the sister declare that the farmer prep2 the girls watches the mothers,DP,feminine,plural,that-clause,,,,,FAILED,declarative,,,,,,,,,
the girls prep1 the actresses say that the daughter prep2 the friend attracts the brother,DP,feminine,plural,that-clause,,,,,FAILED,declarative,,,,,,,,,
the sisters prep1 the actresses say that the daughter prep2 the father greets the brothers,DP,feminine,plural,that-clause,,,,,FAILED,declarative,,,,,,,,,
the mothers prep1 the daughters remember that the sister prep2 the actor welcomes the farmer,DP,feminine,plural,that-clause,,,,,FAILED,declarative,,,,,,,,,
the women prep1 the actresses say that the daughter prep2 the brothers knows the boys,DP,feminine,plural,that-clause,,,,,FAILED,declarative,,,,,,,,,
the sisters prep1 the friends say that the daughter prep2 the men interrupts the girls,DP,feminine,plural,that-clause,,,,,FAILED,declarative,,,,,,,,,
the sisters prep1 the mothers remember that the woman prep2 the friend ignores the actors,DP,feminine,plural,that-clause,,,,,FAILED,declarative,,,,,,,,,
the mothers prep1 the actresses declare that the student prep2 the women ignores the friend,DP,feminine,plural,that-clause,,,,,FAILED,declarative,,,,,,,,,
the mothers prep1 the sisters say that the daughter prep2 the women meets the actors,DP,feminine,plural,that-clause,,,,,FAILED,declarative,,,,,,,,,
the mothers prep1 the daughters say that the student prep2 the women attracts the girl,DP,feminine,plural,that-clause,,,,,FAILED,declarative,,,,,,,,,
the mothers prep1 the friends say that the farmer prep2 the women attracts the girls,DP,feminine,plural,that-clause,,,,,FAILED,declarative,,,,,,,,,
the sisters prep1 the man say that the sisters prep2 the student interrupt the farmer,DP,feminine,plural,that-clause,,,,,FAILED,declarative,,,,,,,,,
the girls prep1 the actor say that the women prep2 the brothers attract the brother,DP,feminine,plural,that-clause,,,,,FAILED,declarative,,,,,,,,,
the farmers prep1 the boy say that the mothers prep2 the daughter meet the brothers,DP,feminine,plural,that-clause,,,,,FAILED,declarative,,,,,,,,,
the farmers prep1 the brother say that the girls prep2 the woman stop the actresses,DP,feminine,plural,that-clause,,,,,FAILED,declarative,,,,,,,,,
the students prep1 the man say that the sisters prep2 the daughters attract the fathers,DP,feminine,plural,that-clause,,,,,FAILED,declarative,,,,,,,,,
the girls prep1 the son remember that the mothers prep2 the women observe the friends,DP,feminine,plural,that-clause,,,,,FAILED,declarative,,,,,,,,,
the girls prep1 the brothers declare that the friends prep2 the student ignore the farmers,DP,feminine,plural,that-clause,,,,,FAILED,declarative,,,,,,,,,
the students prep1 the actors declare that the mothers prep2 the boys interrupt the farmer,DP,feminine,plural,that-clause,,,,,FAILED,declarative,,,,,,,,,
the sisters prep1 the fathers remember that the friends prep2 the brothers observe the sons,DP,feminine,plural,that-clause,,,,,FAILED,declarative,,,,,,,,,
the students prep1 the farmers remember that the women prep2 the friends ignore the sister,DP,feminine,plural,that-clause,,,,,FAILED,declarative,,,,,,,,,
the sisters prep1 the friends say that the daughters prep2 the farmer watch the brother,DP,feminine,plural,that-clause,,,,,FAILED,declarative,,,,,,,,,
the sisters prep1 the brothers say that the mothers prep2 the sister defend the men,DP,feminine,plural,that-clause,,,,,FAILED,declarative,,,,,,,,,
the sisters prep1 the men say that the mothers prep2 the girl stop the friend,DP,feminine,plural,that-clause,,,,,FAILED,declarative,,,,,,,,,
the daughters prep1 the fathers declare that the girls prep2 the actress greet the women,DP,feminine,plural,that-clause,,,,,FAILED,declarative,,,,,,,,,
the students prep1 the men declare that the friends prep2 the actresses watch the fathers,DP,feminine,plural,that-clause,,,,,FAILED,declarative,,,,,,,,,
the friends prep1 the students remember that the mothers prep2 the actresses observe the girls,DP,feminine,plural,that-clause,,,,,FAILED,declarative,,,,,,,,,
the students prep1 the woman remember that the actresses prep2 the friend block the brother,DP,feminine,plural,that-clause,,,,,FAILED,declarative,,,,,,,,,
the friends prep1 the woman say that the actresses prep2 the farmer observe the boys,DP,feminine,plural,that-clause,,,,,FAILED,declarative,,,,,,,,,
the sisters prep1 the friend say that the sisters prep2 the farmer welcome the mother,DP,feminine,plural,that-clause,,,,,FAILED,declarative,,,,,,,,,
the friends prep1 the daughter remember that the girls prep2 the sister attract the brothers,DP,feminine,plural,that-clause,,,,,FAILED,declarative,,,,,,,,,
the sisters prep1 the girl remember that the women prep2 the farmer greet the mother,DP,feminine,plural,that-clause,,,,,FAILED,declarative,,,,,,,,,
the daughters prep1 the girl remember that the farmers prep2 the friends observe the student,DP,feminine,plural,that-clause,,,,,FAILED,declarative,,,,,,,,,
the farmers prep1 the sister say that the mothers prep2 the women stop the brothers,DP,feminine,plural,that-clause,,,,,FAILED,declarative,,,,,,,,,
the farmers prep1 the friend declare that the students prep2 the mothers interrupt the daughters,DP,feminine,plural,that-clause,,,,,FAILED,declarative,,,,,,,,,
the sisters prep1 the actresses remember that the farmers prep2 the father greet the friend,DP,feminine,plural,that-clause,,,,,FAILED,declarative,,,,,,,,,
the sisters prep1 the daughters remember that the students prep2 the farmer meet the actors,DP,feminine,plural,that-clause,,,,,FAILED,declarative,,,,,,,,,
the sisters prep1 the women remember that the actresses prep2 the father block the friend,DP,feminine,plural,that-clause,,,,,FAILED,declarative,,,,,,,,,
the sisters prep1 the farmers say that the actresses prep2 the man know the friends,DP,feminine,plural,that-clause,,,,,FAILED,declarative,,,,,,,,,
the sisters prep1 the mothers declare that the actresses prep2 the student stop the friend,DP,feminine,plural,that-clause,,,,,FAILED,declarative,,,,,,,,,
the mothers prep1 the girls declare that the women prep2 the friend defend the brothers,DP,feminine,plural,that-clause,,,,,FAILED,declarative,,,,,,,,,
the daughters prep1 the women say that the farmers prep2 the actress observe the sisters,DP,feminine,plural,that-clause,,,,,FAILED,declarative,,,,,,,,,
the farmers prep1 the friends remember that the actresses prep2 the daughters defend the brother,DP,feminine,plural,that-clause,,,,,FAILED,declarative,,,,,,,,,
the brother that the man that the brother watches ignores attracts the boys,DP,masculine,singular,,,,,,FAILED,declarative,,,,,,,,,
the actor that the son that the friend interrupts attracts defends the woman,DP,masculine,singular,,,,,,FAILED,declarative,,,,,,,,,
the boy that the father that the student welcomes meets blocks the farmers,DP,masculine,singular,,,,,,FAILED,declarative,,,,,,,,,
the son that the boy that the friends interrupt observes welcomes the man,DP,masculine,singular,,,,,,FAILED,declarative,,,,,,,,,
the actor that the boy that the friends meet ignores attracts the students,DP,masculine,singular,,,,,,FAILED,declarative,,,,,,,,,
the father that the farmer that the daughter welcomes meets defends the man,DP,masculine,singular,,,,,,FAILED,declarative,,,,,,,,,
the actor that the man that the student stops welcomes welcomes the fathers,DP,masculine,singular,,,,,,FAILED,declarative,,,,,,,,,
the student that the father that the girl blocks interrupts greets the sister,DP,masculine,singular,,,,,,FAILED,declarative,,,,,,,,,
the boy that the farmer that the daughter interrupts avoids ignores the students,DP,masculine,singular,,,,,,FAILED,declarative,,,,,,,,,
the father that the actor that the daughters know greets ignores the student,DP,masculine,singular,,,,,,FAILED,declarative,,,,,,,,,
the actor that the father that the sisters attract greets stops the sons,DP,masculine,singular,,,,,,FAILED,declarative,,,,,,,,,
the brother that the friend that the students know greets observes the farmer,DP,masculine,singular,,,,,,FAILED,declarative,,,,,,,,,
the brother that the brother that the farmers avoid blocks defends the friends,DP,masculine,singular,,,,,,FAILED,declarative,,,,,,,,,
the actor that the farmers that the brother observes ignore welcomes the boy,DP,masculine,singular,,,,,,FAILED,declarative,,,,,,,,,
the son that the friends that the boy avoids ignore stops the students,DP,masculine,singular,,,,,,FAILED,declarative,,,,,,,,,
the son that the fathers that the friends watch know stops the farmer,DP,masculine,singular,,,,,,FAILED,declarative,,,,,,,,,
the actor that the boys that the brothers block meet watches the mothers,DP,masculine,singular,,,,,,FAILED,declarative,,,,,,,,,
the friend that the fathers that the woman stops welcome greets the farmer,DP,masculine,singular,,,,,,FAILED,declarative,,,,,,,,,
the brother that the sons that the student watches block ignores the brothers,DP,masculine,singular,,,,,,FAILED,declarative,,,,,,,,,
the actor that the brothers that the girl greets interrupt avoids the sister,DP,masculine,singular,,,,,,FAILED,declarative,,,,,,,,,
the farmer that the fathers that the sisters stop ignore blocks the student,DP,masculine,singular,,,,,,FAILED,declarative,,,,,,,,,
the farmer that the actors that the friends greet ignore meets the students,DP,masculine,singular,,,,,,FAILED,declarative,,,,,,,,,
the student that the girl that the actor welcomes attracts interrupts the farmer,DP,masculine,singular,,,,,,FAILED,declarative,,,,,,,,,
the man that the sister that the boy ignores interrupts avoids the fathers,DP,masculine,singular,,,,,,FAILED,declarative,,,,,,,,,
the brother that the girl that the son stops watches avoids the friends,DP,masculine,singular,,,,,,FAILED,declarative,,,,,,,,,
the actor that the farmer that the sons greet defends avoids the boy,DP,masculine,singular,,,,,,FAILED,declarative,,,,,,,,,
the farmer that the woman that the students avoid welcomes greets the actresses,DP,masculine,singular,,,,,,FAILED,declarative,,,,,,,,,
the actor that the daughter that the woman watches knows meets the farmer,DP,masculine,singular,,,,,,FAILED,declarative,,,,,,,,,
the actor that the sister that the friend welcomes welcomes attracts the fathers,DP,masculine,singular,,,,,,FAILED,declarative,,,,,,,,,
the boy that the daughter that the farmer blocks stops watches the actress,DP,masculine,singular,,,,,,FAILED,declarative,,,,,,,,,
the student that the girl that the mother greets defends ignores the daughters,DP,masculine,singular,,,,,,FAILED,declarative,,,,,,,,,
the farmer that the daughter that the sisters ignore knows meets the man,DP,masculine,singular,,,,,,FAILED,declarative,,,,,,,,,
the boy that the mother that the students ignore attracts stops the actors,DP,masculine,singular,,,,,,FAILED,declarative,,,,,,,,,
the farmer that the daughter that the actresses meet interrupts defends the sister,DP,masculine,singular,,,,,,FAILED,declarative,,,,,,,,,
the father that the actress that the girls observe greets meets the women,DP,masculine,singular,,,,,,FAILED,declarative,,,,,,,,,
the father that the friends that the brother observes avoid welcomes the son,DP,masculine,singular,,,,,,FAILED,declarative,,,,,,,,,
the father that the students that the actor greets block defends the boys,DP,masculine,singular,,,,,,FAILED,declarative,,,,,,,,,
the boy that the actresses that the father greets know observes the friends,DP,masculine,singular,,,,,,FAILED,declarative,,,,,,,,,
the man that the sisters that the friends attract watch welcomes the brother,DP,masculine,singular,,,,,,FAILED,declarative,,,,,,,,,
the son that the friends that the fathers ignore know attracts the students,DP,masculine,singular,,,,,,FAILED,declarative,,,,,,,,,
the friend that the women that the farmers interrupt watch attracts the mother,DP,masculine,singular,,,,,,FAILED,declarative,,,,,,,,,
the father that the students that the actress stops watch knows the farmers,DP,masculine,singular,,,,,,FAILED,declarative,,,,,,,,,
the farmer that the actresses that the daughter blocks meet interrupts the woman,DP,masculine,singular,,,,,,FAILED,declarative,,,,,,,,,
the son that the actresses that the sister blocks attract observes the girls,DP,masculine,singular,,,,,,FAILED,declarative,,,,,,,,,
the brother that the students that the girls ignore meet attracts the actor,DP,masculine,singular,,,,,,FAILED,declarative,,,,,,,,,
