the boy that ignores the farmer avoids the man,DP,masculine,singular,,DP,masculine,singular,,FAILED,declarative,,,,,subject,yes,yes,,
the brother that defends the farmer stops the friends,DP,masculine,singular,,DP,masculine,plural,,FAILED,declarative,,,,,subject,yes,yes,,
a man that avoids the son greets a mother,DP,masculine,singular,,DP,feminine,singular,,FAILED,declarative,,,,,subject,yes,yes,,
the student that meets the man stops the mothers,DP,masculine,singular,,DP,feminine,plural,,FAILED,declarative,,,,,subject,yes,yes,,
man that watches the friends blocks farmers,DP,masculine,singular,,DP,masculine,plural,,FAILED,declarative,,,,,subject,yes,yes,,
friend that interrupts the actors observes daughter,DP,masculine,singular,,DP,feminine,singular,,FAILED,declarative,,,,,subject,yes,yes,,
a son that observes the actors welcomes a students,DP,masculine,singular,,DP,feminine,plural,,FAILED,declarative,,,,,subject,yes,yes,,
the brother that meets the student watches the farmers,DP,masculine,singular,,DP,masculine,plural,,FAILED,declarative,,,,,subject,yes,yes,,
brother that meets the sister ignores farmer,DP,masculine,singular,,DP,feminine,singular,,FAILED,declarative,,,,,subject,yes,yes,,
the brother that greets the farmer ignores the sisters,DP,masculine,singular,,DP,feminine,plural,,FAILED,declarative,,,,,subject,yes,yes,,
a student that knows the girls defends a father,DP,masculine,singular,,DP,masculine,singular,,FAILED,declarative,,,,,subject,yes,yes,,
the brother that attracts the sisters avoids the boys,DP,masculine,singular,,DP,masculine,plural,,FAILED,declarative,,,,,subject,yes,yes,,
a brother that greets the actresses interrupts a sister,DP,masculine,singular,,DP,feminine,singular,,FAILED,declarative,,,,,subject,yes,yes,,
the friend that attracts the girls defends the students,DP,masculine,singular,,DP,feminine,plural,,FAILED,declarative,,,,,subject,yes,yes,,
the brothers that watch the father avoid the boy,DP,masculine,plural,,DP,masculine,singular,,FAILED,declarative,,,,,subject,yes,yes,,
a farmers that attract the boy ignore a students,DP,masculine,plural,,DP,masculine,plural,,FAILED,declarative,,,,,subject,yes,yes,,
sons that stop the student ignore girl,DP,masculine,plural,,DP,feminine,singular,,FAILED,declarative,,,,,subject,yes,yes,,
farmers that attract the student greet daughters,DP,masculine,plural,,DP,feminine,plural,,FAILED,declarative,,,,,subject,yes,yes,,
friends that avoid the farmers greet student,DP,masculine,plural,,DP,masculine,singular,,FAILED,declarative,,,,,subject,yes,yes,,
a friends that know the men greet a farmers,DP,masculine,plural,,DP,masculine,plural,,FAILED,declarative,,,,,subject,yes,yes,,
brothers that defend the friends block daughters,DP,masculine,plural,,DP,feminine,plural,,FAILED,declarative,,,,,subject,yes,yes,,
boys that interrupt the mother know friend,DP,masculine,plural,,DP,masculine,singular,,FAILED,declarative,,,,,subject,yes,yes,,
a friends that defend the woman interrupt a boys,DP,masculine,plural,,DP,masculine,plural,,FAILED,declarative,,,,,subject,yes,yes,,
the brothers that ignore the women welcome the boy,DP,masculine,plural,,DP,masculine,singular,,FAILED,declarative,,,,,subject,yes,yes,,
the fathers that know the sisters defend the sons,DP,masculine,plural,,DP,masculine,plural,,FAILED,declarative,,,,,subject,yes,yes,,
the friends that avoid the students defend the girl,DP,masculine,plural,,DP,feminine,singular,,FAILED,declarative,,,,,subject,yes,yes,,
a sons that interrupt the sisters ignore a girls,DP,masculine,plural,,DP,feminine,plural,,FAILED,declarative,,,,,subject,yes,yes,,
friend that stops the student knows brother,DP,feminine,singular,,DP,masculine,singular,,FAILED,declarative,,,,,subject,yes,yes,,
the sister that knows the student greets the sons,DP,feminine,singular,,DP,masculine,plural,,FAILED,declarative,,,,,subject,yes,yes,,
the mother that watches the student stops the girl,DP,feminine,singular,,DP,feminine,singular,,FAILED,declarative,,,,,subject,yes,yes,,
a student that blocks the man welcomes a sisters,DP,feminine,singular,,DP,feminine,plural,,FAILED,declarative,,,,,subject,yes,yes,,
a sister that interrupts the students blocks a boys,DP,feminine,singular,,DP,masculine,plural,,FAILED,declarative,,,,,subject,yes,yes,,
mother that watches the boys interrupts farmer,DP,feminine,singular,,DP,feminine,singular,,FAILED,declarative,,,,,subject,yes,yes,,
girl that avoids the brothers knows daughters,DP,feminine,singular,,DP,feminine,plural,,FAILED,declarative,,,,,subject,yes,yes,,
the sister that welcomes the mother attracts the sons,DP,feminine,singular,,DP,masculine,plural,,FAILED,declarative,,,,,subject,yes,yes,,
the woman that defends the actress blocks the friend,DP,feminine,singular,,DP,feminine,singular,,FAILED,declarative,,,,,subject,yes,yes,,
a friend that blocks the farmers observes an actor,DP,feminine,singular,,DP,masculine,singular,,FAILED,declarative,,,,,subject,yes,yes,,
the sister that blocks the girls avoids the students,DP,feminine,singular,,DP,masculine,plural,,FAILED,declarative,,,,,subject,yes,yes,,
girl that watches the sisters interrupts actress,DP,feminine,singular,,DP,feminine,singular,,FAILED,declarative,,,,,subject,yes,yes,,
a daughter that meets the mothers avoids an actresses,DP,feminine,singular,,DP,feminine,plural,,FAILED,declarative,,,,,subject,yes,yes,,
girls that interrupt the farmer greet man,DP,feminine,plural,,DP,masculine,singular,,FAILED,declarative,,,,,subject,yes,yes,,
the sisters that interrupt the father avoid the friends,DP,feminine,plural,,DP,masculine,plural,,FAILED,declarative,,,,,subject,yes,yes,,
the daughters that stop the brother meet the student,DP,feminine,plural,,DP,feminine,singular,,FAILED,declarative,,,,,subject,yes,yes,,
friends that defend the brothers block students,DP,feminine,plural,,DP,masculine,plural,,FAILED,declarative,,,,,subject,yes,yes,,
the actresses that meet the boys greet the student,DP,feminine,plural,,DP,feminine,singular,,FAILED,declarative,,,,,subject,yes,yes,,
the mothers that greet the farmers know the sisters,DP,feminine,plural,,DP,feminine,plural,,FAILED,declarative,,,,,subject,yes,yes,,
daughters that greet the farmer interrupt friend,DP,feminine,plural,,DP,masculine,singular,,FAILED,declarative,,,,,subject,yes,yes,,
the actresses that avoid the mother meet the boys,DP,feminine,plural,,DP,masculine,plural,,FAILED,declarative,,,,,subject,yes,yes,,
the students that avoid the mother ignore the friend,DP,feminine,plural,,DP,feminine,singular,,FAILED,declarative,,,,,subject,yes,yes,,
the women that observe the actress interrupt the students,DP,feminine,plural,,DP,feminine,plural,,FAILED,declarative,,,,,subject,yes,yes,,
the sisters that observe the women block the boy,DP,feminine,plural,,DP,masculine,singular,,FAILED,declarative,,,,,subject,yes,yes,,
daughters that welcome the women stop brothers,DP,feminine,plural,,DP,masculine,plural,,FAILED,declarative,,,,,subject,yes,yes,,
the women that defend the girls attract the friend,DP,feminine,plural,,DP,feminine,singular,,FAILED,declarative,,,,,subject,yes,yes,,
the actresses that avoid the students attract the girls,DP,feminine,plural,,DP,feminine,plural,,FAILED,declarative,,,,,subject,yes,yes,,
the student that the man welcomes blocks the son,DP,masculine,singular,,DP,masculine,singular,,FAILED,declarative,,,,,object,w1__number == w2__number,w1__gender == w2__gender,,
the actor that the boy ignores observes the women,DP,masculine,singular,,DP,feminine,plural,,FAILED,declarative,,,,,object,w1__number == w2__number,w1__gender == w2__gender,,
the boy that the fathers ignore defends the man,DP,masculine,singular,,DP,masculine,singular,,FAILED,declarative,,,,,object,w1__number == w2__number,w1__gender == w2__gender,,
the son that the men greet attracts the mother,DP,masculine,singular,,DP,feminine,singular,,FAILED,declarative,,,,,object,w1__number == w2__number,w1__gender == w2__gender,,
student that the friends attract watches women,DP,masculine,singular,,DP,feminine,plural,,FAILED,declarative,,,,,object,w1__number == w2__number,w1__gender == w2__gender,,
an actor that the woman interrupts stops a friend,DP,masculine,singular,,DP,masculine,singular,,FAILED,declarative,,,,,object,w1__number == w2__number,w1__gender == w2__gender,,
a man that the friend meets knows an actress,DP,masculine,singular,,DP,feminine,singular,,FAILED,declarative,,,,,object,w1__number == w2__number,w1__gender == w2__gender,,
son that the girl observes blocks farmers,DP,masculine,singular,,DP,feminine,plural,,FAILED,declarative,,,,,object,w1__number == w2__number,w1__gender == w2__gender,,
the actor that the daughters stop interrupts the friend,DP,masculine,singular,,DP,masculine,singular,,FAILED,declarative,,,,,object,w1__number == w2__number,w1__gender == w2__gender,,
the father that the friends greet observes the farmers,DP,masculine,singular,,DP,masculine,plural,,FAILED,declarative,,,,,object,w1__number == w2__number,w1__gender == w2__gender,,
the student that the actresses watch attracts the girl,DP,masculine,singular,,DP,feminine,singular,,FAILED,declarative,,,,,object,w1__number == w2__number,w1__gender == w2__gender,,
a farmer that the sisters know blocks a mothers,DP,masculine,singular,,DP,feminine,plural,,FAILED,declarative,,,,,object,w1__number == w2__number,w1__gender == w2__gender,,
a boys that the brother ignores block a student,DP,masculine,plural,,DP,masculine,singular,,FAILED,declarative,,,,,object,w1__number == w2__number,w1__gender == w2__gender,,
farmers that the son watches stop friends,DP,masculine,plural,,DP,masculine,plural,,FAILED,declarative,,,,,object,w1__number == w2__number,w1__gender == w2__gender,,
a brothers that the actor stops ignore a sister,DP,masculine,plural,,DP,feminine,singular,,FAILED,declarative,,,,,object,w1__number == w2__number,w1__gender == w2__gender,,
an actors that the friends defend meet a man,DP,masculine,plural,,DP,masculine,singular,,FAILED,declarative,,,,,object,w1__number == w2__number,w1__gender == w2__gender,,
fathers that the farmers interrupt defend students,DP,masculine,plural,,DP,masculine,plural,,FAILED,declarative,,,,,object,w1__number == w2__number,w1__gender == w2__gender,,
a friends that the boys attract welcome a mothers,DP,masculine,plural,,DP,feminine,plural,,FAILED,declarative,,,,,object,w1__number == w2__number,w1__gender == w2__gender,,
a friends that the sister watches observe a brother,DP,masculine,plural,,DP,masculine,singular,,FAILED,declarative,,,,,object,w1__number == w2__number,w1__gender == w2__gender,,
farmers that the friend interrupts ignore girl,DP,masculine,plural,,DP,feminine,singular,,FAILED,declarative,,,,,object,w1__number == w2__number,w1__gender == w2__gender,,
men that the student watches defend daughters,DP,masculine,plural,,DP,feminine,plural,,FAILED,declarative,,,,,object,w1__number == w2__number,w1__gender == w2__gender,,
the boys that the daughters greet stop the father,DP,masculine,plural,,DP,masculine,singular,,FAILED,declarative,,,,,object,w1__number == w2__number,w1__gender == w2__gender,,
the friends that the girls welcome interrupt the sons,DP,masculine,plural,,DP,masculine,plural,,FAILED,declarative,,,,,object,w1__number == w2__number,w1__gender == w2__gender,,
the students that the mothers watch observe the girl,DP,masculine,plural,,DP,feminine,singular,,FAILED,declarative,,,,,object,w1__number == w2__number,w1__gender == w2__gender,,
the friends that the actresses meet block the women,DP,masculine,plural,,DP,feminine,plural,,FAILED,declarative,,,,,object,w1__number == w2__number,w1__gender == w2__gender,,
the actress that the student observes greets the friend,DP,feminine,singular,,DP,masculine,singular,,FAILED,declarative,,,,,object,w1__number == w2__number,w1__gender == w2__gender,,
daughter that the actor defends watches sister,DP,feminine,singular,,DP,feminine,singular,,FAILED,declarative,,,,,object,w1__number == w2__number,w1__gender == w2__gender,,
woman that the son ignores avoids actresses,DP,feminine,singular,,DP,feminine,plural,,FAILED,declarative,,,,,object,w1__number == w2__number,w1__gender == w2__gender,,
the student that the boys know ignores the man,DP,feminine,singular,,DP,masculine,singular,,FAILED,declarative,,,,,object,w1__number == w2__number,w1__gender == w2__gender,,
the girl that the students welcome meets the sister,DP,feminine,singular,,DP,feminine,singular,,FAILED,declarative,,,,,object,w1__number == w2__number,w1__gender == w2__gender,,
farmer that the students ignore interrupts girls,DP,feminine,singular,,DP,feminine,plural,,FAILED,declarative,,,,,object,w1__number == w2__number,w1__gender == w2__gender,,
girl that the actress greets welcomes father,DP,feminine,singular,,DP,masculine,singular,,FAILED,declarative,,,,,object,w1__number == w2__number,w1__gender == w2__gender,,
the actress that the student attracts knows the friend,DP,feminine,singular,,DP,feminine,singular,,FAILED,declarative,,,,,object,w1__number == w2__number,w1__gender == w2__gender,,
the sister that the sister interrupts greets the actresses,DP,feminine,singular,,DP,feminine,plural,,FAILED,declarative,,,,,object,w1__number == w2__number,w1__gender == w2__gender,,
the woman that the daughters welcome interrupts the father,DP,feminine,singular,,DP,masculine,singular,,FAILED,declarative,,,,,object,w1__number == w2__number,w1__gender == w2__gender,,
the girl that the students watch knows the fathers,DP,feminine,singular,,DP,masculine,plural,,FAILED,declarative,,,,,object,w1__number == w2__number,w1__gender == w2__gender,,
the sister that the daughters defend welcomes the woman,DP,feminine,singular,,DP,feminine,singular,,FAILED,declarative,,,,,object,w1__number == w2__number,w1__gender == w2__gender,,
a friend that the actresses attract interrupts a farmers,DP,feminine,singular,,DP,feminine,plural,,FAILED,declarative,,,,,object,w1__number == w2__number,w1__gender == w2__gender,,
the girls that the friend watches defend the actor,DP,feminine,plural,,DP,masculine,singular,,FAILED,declarative,,,,,object,w1__number == w2__number,w1__gender == w2__gender,,
actresses that the brother defends ignore friend,DP,feminine,plural,,DP,feminine,singular,,FAILED,declarative,,,,,object,w1__number == w2__number,w1__gender == w2__gender,,
the mothers that the men avoid block the boy,DP,feminine,plural,,DP,masculine,singular,,FAILED,declarative,,,,,object,w1__number == w2__number,w1__gender == w2__gender,,
a students that the friends know attract an actors,DP,feminine,plural,,DP,masculine,plural,,FAILED,declarative,,,,,object,w1__number == w2__number,w1__gender == w2__gender,,
the students that the brothers know defend the sister,DP,feminine,plural,,DP,feminine,singular,,FAILED,declarative,,,,,object,w1__number == w2__number,w1__gender == w2__gender,,
the students that the men interrupt observe the friends,DP,feminine,plural,,DP,feminine,plural,,FAILED,declarative,,,,,object,w1__number == w2__number,w1__gender == w2__gender,,
mothers that the sister greets block brother,DP,feminine,plural,,DP,masculine,singular,,FAILED,declarative,,,,,object,w1__number == w2__number,w1__gender == w2__gender,,
mothers that the friend stops observe brothers,DP,feminine,plural,,DP,masculine,plural,,FAILED,declarative,,,,,object,w1__number == w2__number,w1__gender == w2__gender,,
the actresses that the girl meets observe the student,DP,feminine,plural,,DP,feminine,singular,,FAILED,declarative,,,,,object,w1__number == w2__number,w1__gender == w2__gender,,
a farmers that the sister interrupts greet a students,DP,feminine,plural,,DP,feminine,plural,,FAILED,declarative,,,,,object,w1__number == w2__number,w1__gender == w2__gender,,
the mothers that the women welcome attract the friend,DP,feminine,plural,,DP,masculine,singular,,FAILED,declarative,,,,,object,w1__number == w2__number,w1__gender == w2__gender,,
an actresses that the sisters block interrupt a men,DP,feminine,plural,,DP,masculine,plural,,FAILED,declarative,,,,,object,w1__number == w2__number,w1__gender == w2__gender,,
the daughters that the friends watch stop the actress,DP,feminine,plural,,DP,feminine,singular,,FAILED,declarative,,,,,object,w1__number == w2__number,w1__gender == w2__gender,,
a farmers that the women greet watch an actresses,DP,feminine,plural,,DP,feminine,plural,,FAILED,declarative,,,,,object,w1__number == w2__number,w1__gender == w2__gender,,
man that he ignores observes father,DP,masculine,singular,,DP,masculine,singular,,FAILED,declarative,,,,,object,w1__number == w2__number,w1__gender == w2__gender,,
student that he interrupts greets boys,DP,masculine,singular,,DP,masculine,plural,,FAILED,declarative,,,,,object,w1__number == w2__number,w1__gender == w2__gender,,
son that he blocks knows woman,DP,masculine,singular,,DP,feminine,singular,,FAILED,declarative,,,,,object,w1__number == w2__number,w1__gender == w2__gender,,
a friend that he attracts stops a farmers,DP,masculine,singular,,DP,feminine,plural,,FAILED,declarative,,,,,object,w1__number == w2__number,w1__gender == w2__gender,,
the friend that they watch defends the actor,DP,masculine,singular,,DP,masculine,singular,,FAILED,declarative,,,,,object,w1__number == w2__number,w1__gender == w2__gender,,
the son that they stop watches the men,DP,masculine,singular,,DP,masculine,plural,,FAILED,declarative,,,,,object,w1__number == w2__number,w1__gender == w2__gender,,
the son that they greet blocks the sister,DP,masculine,singular,,DP,feminine,singular,,FAILED,declarative,,,,,object,w1__number == w2__number,w1__gender == w2__gender,,
student that they meet attracts women,DP,masculine,singular,,DP,feminine,plural,,FAILED,declarative,,,,,object,w1__number == w2__number,w1__gender == w2__gender,,
boy that she watches knows son,DP,masculine,singular,,DP,masculine,singular,,FAILED,declarative,,,,,object,w1__number == w2__number,w1__gender == w2__gender,,
the son that she interrupts watches the brothers,DP,masculine,singular,,DP,masculine,plural,,FAILED,declarative,,,,,object,w1__number == w2__number,w1__gender == w2__gender,,
the friend that she attracts welcomes the girl,DP,masculine,singular,,DP,feminine,singular,,FAILED,declarative,,,,,object,w1__number == w2__number,w1__gender == w2__gender,,
the actor that she meets interrupts the friends,DP,masculine,singular,,DP,feminine,plural,,FAILED,declarative,,,,,object,w1__number == w2__number,w1__gender == w2__gender,,
a son that they meet attracts a father,DP,masculine,singular,,DP,masculine,singular,,FAILED,declarative,,,,,object,w1__number == w2__number,w1__gender == w2__gender,,
a farmer that they interrupt watches a fathers,DP,masculine,singular,,DP,masculine,plural,,FAILED,declarative,,,,,object,w1__number == w2__number,w1__gender == w2__gender,,
actor that they avoid observes girl,DP,masculine,singular,,DP,feminine,singular,,FAILED,declarative,,,,,object,w1__number == w2__number,w1__gender == w2__gender,,
the brothers that he greets stop the student,DP,masculine,plural,,DP,masculine,singular,,FAILED,declarative,,,,,object,w1__number == w2__number,w1__gender == w2__gender,,
the sons that he ignores stop the fathers,DP,masculine,plural,,DP,masculine,plural,,FAILED,declarative,,,,,object,w1__number == w2__number,w1__gender == w2__gender,,
the brothers that he defends attract the student,DP,masculine,plural,,DP,feminine,singular,,FAILED,declarative,,,,,object,w1__number == w2__number,w1__gender == w2__gender,,
the actors that he observes defend the friends,DP,masculine,plural,,DP,feminine,plural,,FAILED,declarative,,,,,object,w1__number == w2__number,w1__gender == w2__gender,,
the actors that they watch avoid the son,DP,masculine,plural,,DP,masculine,singular,,FAILED,declarative,,,,,object,w1__number == w2__number,w1__gender == w2__gender,,
the farmers that they defend interrupt the men,DP,masculine,plural,,DP,masculine,plural,,FAILED,declarative,,,,,object,w1__number == w2__number,w1__gender == w2__gender,,
actors that they interrupt watch woman,DP,masculine,plural,,DP,feminine,singular,,FAILED,declarative,,,,,object,w1__number == w2__number,w1__gender == w2__gender,,
a farmers that they defend meet a mothers,DP,masculine,plural,,DP,feminine,plural,,FAILED,declarative,,,,,object,w1__number == w2__number,w1__gender == w2__gender,,
the friends that she observes defend the son,DP,masculine,plural,,DP,masculine,singular,,FAILED,declarative,,,,,object,w1__number == w2__number,w1__gender == w2__gender,,
the fathers that she interrupts defend the sons,DP,masculine,plural,,DP,masculine,plural,,FAILED,declarative,,,,,object,w1__number == w2__number,w1__gender == w2__gender,,
the men that she ignores greet the daughter,DP,masculine,plural,,DP,feminine,singular,,FAILED,declarative,,,,,object,w1__number == w2__number,w1__gender == w2__gender,,
the students that she avoids meet the mothers,DP,masculine,plural,,DP,feminine,plural,,FAILED,declarative,,,,,object,w1__number == w2__number,w1__gender == w2__gender,,
an actors that they meet attract a father,DP,masculine,plural,,DP,masculine,singular,,FAILED,declarative,,,,,object,w1__number == w2__number,w1__gender == w2__gender,,
a friends that they defend block an actors,DP,masculine,plural,,DP,masculine,plural,,FAILED,declarative,,,,,object,w1__number == w2__number,w1__gender == w2__gender,,
brothers that they observe ignore girl,DP,masculine,plural,,DP,feminine,singular,,FAILED,declarative,,,,,object,w1__number == w2__number,w1__gender == w2__gender,,
actors that they welcome know daughters,DP,masculine,plural,,DP,feminine,plural,,FAILED,declarative,,,,,object,w1__number == w2__number,w1__gender == w2__gender,,
the mother that he defends observes the son,DP,feminine,singular,,DP,masculine,singular,,FAILED,declarative,,,,,object,w1__number == w2__number,w1__gender == w2__gender,,
an actress that he stops watches a men,DP,feminine,singular,,DP,masculine,plural,,FAILED,declarative,,,,,object,w1__number == w2__number,w1__gender == w2__gender,,
the actress that he attracts welcomes the woman,DP,feminine,singular,,DP,feminine,singular,,FAILED,declarative,,,,,object,w1__number == w2__number,w1__gender == w2__gender,,
the daughter that he watches meets the women,DP,feminine,singular,,DP,feminine,plural,,FAILED,declarative,,,,,object,w1__number == w2__number,w1__gender == w2__gender,,
the farmer that they avoid watches the son,DP,feminine,singular,,DP,masculine,singular,,FAILED,declarative,,,,,object,w1__number == w2__number,w1__gender == w2__gender,,
a girl that they stop interrupts a friends,DP,feminine,singular,,DP,masculine,plural,,FAILED,declarative,,,,,object,w1__number == w2__number,w1__gender == w2__gender,,
sister that they interrupt stops farmer,DP,feminine,singular,,DP,feminine,singular,,FAILED,declarative,,,,,object,w1__number == w2__number,w1__gender == w2__gender,,
student that they stop meets sisters,DP,feminine,singular,,DP,feminine,plural,,FAILED,declarative,,,,,object,w1__number == w2__number,w1__gender == w2__gender,,
the daughter that she stops greets the actors,DP,feminine,singular,,DP,masculine,plural,,FAILED,declarative,,,,,object,w1__number == w2__number,w1__gender == w2__gender,,
a girl that she blocks meets a woman,DP,feminine,singular,,DP,feminine,singular,,FAILED,declarative,,,,,object,w1__number == w2__number,w1__gender == w2__gender,,
mother that she watches ignores girls,DP,feminine,singular,,DP,feminine,plural,,FAILED,declarative,,,,,object,w1__number == w2__number,w1__gender == w2__gender,,
the farmer that they welcome knows the actors,DP,feminine,singular,,DP,masculine,plural,,FAILED,declarative,,,,,object,w1__number == w2__number,w1__gender == w2__gender,,
the woman that they watch knows the mother,DP,feminine,singular,,DP,feminine,singular,,FAILED,declarative,,,,,object,w1__number == w2__number,w1__gender == w2__gender,,
girl that they avoid meets sisters,DP,feminine,singular,,DP,feminine,plural,,FAILED,declarative,,,,,object,w1__number == w2__number,w1__gender == w2__gender,,
women that he ignores know student,DP,feminine,plural,,DP,masculine,singular,,FAILED,declarative,,,,,object,w1__number == w2__number,w1__gender == w2__gender,,
a girls that he attracts stop a fathers,DP,feminine,plural,,DP,masculine,plural,,FAILED,declarative,,,,,object,w1__number == w2__number,w1__gender == w2__gender,,
a sisters that he ignores stop a girl,DP,feminine,plural,,DP,feminine,singular,,FAILED,declarative,,,,,object,w1__number == w2__number,w1__gender == w2__gender,,
students that they greet interrupt son,DP,feminine,plural,,DP,masculine,singular,,FAILED,declarative,,,,,object,w1__number == w2__number,w1__gender == w2__gender,,
the girls that they observe meet the sons,DP,feminine,plural,,DP,masculine,plural,,FAILED,declarative,,,,,object,w1__number == w2__number,w1__gender == w2__gender,,
the farmers that they avoid attract the woman,DP,feminine,plural,,DP,feminine,singular,,FAILED,declarative,,,,,object,w1__number == w2__number,w1__gender == w2__gender,,
the students that they greet welcome the mothers,DP,feminine,plural,,DP,feminine,plural,,FAILED,declarative,,,,,object,w1__number == w2__number,w1__gender == w2__gender,,
the friends that she observes interrupt the father,DP,feminine,plural,,DP,masculine,singular,,FAILED,declarative,,,,,object,w1__number == w2__number,w1__gender == w2__gender,,
sisters that she meets defend men,DP,feminine,plural,,DP,masculine,plural,,FAILED,declarative,,,,,object,w1__number == w2__number,w1__gender == w2__gender,,
the daughters that she blocks meet the farmer,DP,feminine,plural,,DP,feminine,singular,,FAILED,declarative,,,,,object,w1__number == w2__number,w1__gender == w2__gender,,
the girls that she meets watch the daughters,DP,feminine,plural,,DP,feminine,plural,,FAILED,declarative,,,,,object,w1__number == w2__number,w1__gender == w2__gender,,
women that they observe stop farmer,DP,feminine,plural,,DP,masculine,singular,,FAILED,declarative,,,,,object,w1__number == w2__number,w1__gender == w2__gender,,
